{
  "schema": "lemonpress.manga-parcel/v0",
  "parcel_id": "manga-parcel:7bf10323cac82bdb8a1d9d2fdf883b177a8888d04da28963963f87f837cf3656",
  "status": "INCUBATING",
  "title": "National Treasure — Seed Zero",
  "created_at": "2026-10-06T21:06:00.000Z",
  "source": {
    "kind": "image",
    "provider": "google-drive",
    "provider_file_id": "10qbINj938lqqatl7nVikoNUo1geE-T6H",
    "file_name": "file_000000001164820db1a05ce868d31660.png",
    "media_type": "image/png",
    "byte_length": 3521543,
    "sha256": "7531b551c433fe947658bb9731e9271a8636f1e3a5f57b41827c1925bed295ff",
    "pixel_dimensions": {
      "width": 1312,
      "height": 1199
    },
    "locator": "https://drive.google.com/file/d/10qbINj938lqqatl7nVikoNUo1geE-T6H/view"
  },
  "rights": {
    "basis": "user-declared-controlled-source",
    "verification": "not-independently-verified",
    "note": "The rights declaration is provenance metadata, not a legal determination by LemonPRESS or reLATTE."
  },
  "plan_sha256": "6f4defc2b216064cd48153cf08c3429679d9a03791b6ca39f97a3129724eb27c",
  "issue_plan": {
    "kind": "virtual-five-page-micro-issue",
    "render_rule": "Every page is a reversible projection of the exact source pixels until a descendant is explicitly admitted.",
    "pages": [
      {
        "page": 1,
        "label": "OPENING / THE QUESTION",
        "source_region_px": {
          "x": 0,
          "y": 0,
          "width": 1312,
          "height": 274
        }
      },
      {
        "page": 2,
        "label": "CASES 1–4 / CONTROL + PROJECTION",
        "source_region_px": {
          "x": 0,
          "y": 274,
          "width": 1312,
          "height": 284
        }
      },
      {
        "page": 3,
        "label": "CASES 5–8 / MEMORY + ROAD",
        "source_region_px": {
          "x": 0,
          "y": 558,
          "width": 1312,
          "height": 279
        }
      },
      {
        "page": 4,
        "label": "CASES 9–12 / PARTICULAR → PATTERN",
        "source_region_px": {
          "x": 0,
          "y": 837,
          "width": 1312,
          "height": 259
        }
      },
      {
        "page": 5,
        "label": "FIELD NOTES / OPEN ENDEDNESS",
        "source_region_px": {
          "x": 0,
          "y": 1096,
          "width": 1312,
          "height": 103
        }
      }
    ]
  },
  "descendant_slots": [
    {
      "role": "print-pages",
      "media_type": "image/png",
      "state": "CANDIDATE"
    },
    {
      "role": "narration",
      "media_type": "audio/*",
      "state": "UNBORN"
    },
    {
      "role": "motion-edition",
      "media_type": "video/*",
      "state": "UNBORN"
    },
    {
      "role": "soundtrack-or-stems",
      "media_type": "audio/*",
      "state": "UNBORN"
    },
    {
      "role": "crawler-edition",
      "media_type": "text/markdown",
      "state": "UNBORN"
    }
  ],
  "laws": [
    "SOURCE != PROJECTION",
    "DESCENDANT != ANCESTOR",
    "CROP != SOURCE MUTATION",
    "RENDERING != AUTHORITY",
    "PROVENANCE != OWNERSHIP DETERMINATION",
    "PARCEL MAY CROSS; ADMISSION REMAINS LOCAL"
  ]
}
